Keywords from survey,Situations,Phrases
,,Stranded at the airport due to canceled flights. No support staff
,,Wild boar on the trail ahead; no idea how to get past it
,,"Hotel fire exit blocked, and there’s smoke in the hallway"
,,"Someone is chasing me, pls hlp!"
,,"Sm1’s following me, need hlp fast!"
,,"Ayuda! Someone behind me, hurry!"
,,Pls help! I’m being chased rn!
,,¡Socorro! Somebody’s chasing me!
,,I’m trapped in the building; fire everywhere!
,,Stuck inside! There’s fire! Send hlp now!
,,"Incendio! Can’t get out, trapped!"
,,I can’t escape flames everywhere!
,,Lost my kid in the market help me find them!
,,My child’s missing! Pls help!
,,"Niño perdido en el mercado, ayuda!"
,,Kid’s gone! Can’t see them anywhere!
,,There’s a man with a knife! Danger!
,,Armed man nearby! Save us!
,,Knife attack we’re in danger!
,,¡Cuidado! Hombre con cuchillo!
,,"Sm1 w/ knife, pls hurry!!"
,,Flood waters rising fast we’re stuck!
,,Flooded road can’t move! Hlp!
,,"El agua está subiendo, ¡ayuda!"
,,Stranded in water urgent hlp!
,,I fell I think I broke my leg!
,,Broken leg can’t move send hlp!
,,"Caí, mi pierna duele mucho!"
,,"I’m hurt, leg broken, pls assist!"
,,My wallet’s stolen I’m stranded!
,,"Sm1 took my wallet, I’m stuck!"
,,No tengo mi cartera estoy perdido!
,,"Lost my money, need urgent hlp!"
,,"We’re lost in the jungle, can’t find the trail."
,,"Lost hiking, need direction!"
,,"Perdidos en el bosque, ayuda!"
,,"Disoriented, no trail visible, pls hlp!"
,,Driver refusing to stop I’m scared!
,,"Taxi driver won’t stop, unsafe!"
,,"Chofer no para, ¡me da miedo!"
,,"Cab driver acting weird, pls assist!"
,,"Can’t swim, stuck in the river!"
,,"Stranded in water, drowning!"
,,"¡Socorro! Estoy en el agua, no sé nadar!"
,,Pls hurry! I’m sinking!
,,There’s smoke in the building no way out!
,,Smoke filling rooms can’t escape!
,,"Fuego y humo, no hay salida!"
,,Pls help! Trapped w/ smoke everywhere!
,,Saw a car crash people trapped inside!
,,Accident! Ppl need help ASAP!
,,"Choque de autos, hay heridos!"
,,"Big crash, urgent medical hlp needed!"
,,Someone fainted we need a medic!
,,"Person unconscious, CPR needed!"
,,"¡Alguien se desmayó, rápido!"
,,"Sm1 passed out, not waking up!"
,,I’m locked in this room can’t open the door!
,,"Door’s jammed, stuck inside!"
,,"Cerradura rota, no puedo salir!"
,,"Trapped inside, need hlp urgently!"
,,Snowstorm is blocking the road we’re stuck!
,,Stuck in blizzard need hlp!
,,Tormenta de nieve estamos atrapados!
,,"Snowed in, can’t drive, send hlp!"
,,Gunshots nearby hiding now!
,,Shots fired too scared to move!
,,"Tiros cerca, estoy escondido!"
,,"Sm1 shooting, we need police now!"
,,Child stuck in the water help now!
,,"My kid’s drowning, hurry up!"
,,"¡Niño en el agua, urgente ayuda!"
,,Can’t reach my kid pls send hlp!
,,Aggressive animal blocking the way!
,,Wild dog can’t move forward!
,,Animal salvaje bloqueando el camino!
,,Dog attack! Need assistance!
,,Earthquake! Building shaking hard!
,,Terremoto! El edificio se está moviendo!
,,"Everything’s shaking, too scared to leave!"
,,"Big earthquake, stuck indoors!"
,,Group threatening us we’re scared!
,,"Sm1 threatening my group, urgent hlp!"
,,"Nos amenazan, estamos asustados!"
,,"Gang nearby, need police now!"
,,"Faint smell of gas, feels unsafe here."
,,"Gas leak suspected, help us!"
,,"Huele a gas, puede ser peligroso!"
,,Smelling gas not sure what to do!
,,"Boat sinking, water coming in fast!"
,,"Sinking boat, drowning!"
,,"¡Barco hundiéndose, rápido ayuda!"
,,Emergency! Our boat’s going down!
,,Car stuck on a flooded bridge!
,,Water rising car stranded!
,,"Puente inundado, estamos atrapados!"
,,Stuck on bridge pls send hlp fast!
,,My phone’s almost dead I’m lost!
,,"Battery dying, I’m stuck! Pls help!"
,,"Teléfono sin batería, perdido!"
,,"Lost, no phone batt, need hlp fast!"
,,Tourist scammed me I’m stranded now!
,,"Scammed by locals, need police hlp!"
,,Me estafaron estoy sin dinero!
,,Urgent help! Tourist guide scammed me!
,,I lost my wallet and my ID is missing
,,My phone was stolen and I need help contacting someone
,,I am stranded on a deserted road with no help in sight
,,I need urgent medical assistance I think I broke my leg
,,My friend fainted and is not responding we need a doctor
,,There is a fire in the building and I cannot find a way out
,,I feel unsafe someone has been following me for a while
,,I got separated from my group and I am completely lost
,,My bag with all my belongings was snatched I need help
,,I am in severe pain and cannot walk please send help
,,My child is missing and I cannot find them anywhere
,,I am trapped in an elevator and cannot get out
,,There is flooding here and I am stuck on the roof
,,I was attacked by someone and I need the police urgently
,,There is a wild animal nearby and I feel like it might attack
,,I slipped and injured my back and cannot move
,,The weather is terrible and I am stranded without shelter
,,My rental car broke down and I am stuck on the highway
,,I need a doctor someone around me is not breathing
,,I saw someone collapse on the road and they need immediate help
,,I have been robbed and need to report it to the authorities
,,I am stuck in a storm and I am unable to find safety
,,My passport and documents are missing I need help urgently
,,I think I was bitten by a poisonous animal and need medical help
,,I have been stranded at the train station with no place to go
,,I feel dizzy and lightheaded and I think I might faint
,,My bike broke down and I am stuck in an isolated area
,,I need help someone is threatening me and I feel unsafe
,,I cannot find the nearest hospital and need help urgently
,,I am lost in the forest and it is getting dark please send help
,,"The taxi driver is taking a different route, and I don’t feel safe"
,,"I’m stuck in a subway station, and there’s no staff around to help me"
,,Someone is aggressively knocking on my hotel door. I’m scared
,,"The ferry left without me, and now I’m stranded on the island"
,,"I can see a huge fire in the distance, but I don’t know if it’s safe to stay here"
,,"There’s been a landslide, and I’m trapped on this hiking trail"
,,I feel disoriented after a bad fall. I don’t know where I am
,,"I’ve lost my medication, and I need a pharmacy urgently"
,,A stranger is blocking my way and won’t let me pass. I feel unsafe
,,"I missed the last train, and I’m stuck at the station overnight"
,,"I’ve been stung by a bee, and I think I’m having an allergic reaction"
,,"There’s heavy snow, and my car is stuck. I can’t drive any further"
,,A stranger tried to grab my arm in the park. I need someone to help me
,,"I’ve been locked inside a shop, and there’s no way to get out"
,,The lift stopped midway