Phrases,spaCy_NER,KeyBERT
i am stranded on a deserted road with no help in sight,[],"['stranded', 'deserted', 'road', 'sight', 'help']"
i need urgent medical assistance i think i broke my leg,[],"['leg', 'broke', 'assistance', 'medical', 'urgent']"
my friend fainted and is not responding we need a doctor,[],"['fainted', 'doctor', 'need', 'friend', 'responding']"
there is a fire in the building and i cannot find a way out,[],"['building', 'way']"
i feel unsafe someone has been following me for a while,[],"['unsafe', 'following', 'feel']"
i got separated from my group and i am completely lost,[],"['group', 'separated', 'lost', 'got', 'completely']"
my bag with all my belongings was snatched i need help,[],"['belongings', 'bag', 'snatched', 'help', 'need']"
i am in severe pain and cannot walk please send help,[],"['walk', 'pain', 'severe', 'help', 'send']"
my child is missing and i cannot find them anywhere,[],"['missing', 'child']"
i am trapped in an elevator and cannot get out,[],"['elevator', 'trapped']"
there is flooding here and i am stuck on the roof,[],"['roof', 'flooding', 'stuck']"
i was attacked by someone and i need the police urgently,[],"['police', 'attacked', 'need', 'urgently']"
there is a wild animal nearby and i feel like it might attack,[],"['animal', 'attack', 'wild', 'nearby', 'like']"
i slipped and injured my back and cannot move,[],"['slipped', 'injured']"
the weather is terrible and i am stranded without shelter,[],"['shelter', 'stranded', 'weather', 'terrible']"
my rental car broke down and i am stuck on the highway,[],"['highway', 'car', 'broke', 'stuck', 'rental']"
i need a doctor someone around me is not breathing,[],"['breathing', 'doctor', 'need']"
i saw someone collapse on the road and they need immediate help,[],"['collapse', 'road', 'need', 'immediate', 'help']"
i have been robbed and need to report it to the authorities,[],"['robbed', 'authorities', 'report', 'need']"
i am stuck in a storm and i am unable to find safety,[],"['storm', 'safety', 'stuck', 'unable']"
my passport and documents are missing i need help urgently,[],"['passport', 'documents', 'missing', 'urgently', 'need']"
i think i was bitten by a poisonous animal and need medical help,[],"['poisonous', 'bitten', 'animal', 'medical', 'help']"
i have been stranded at the train station with no place to go,[],"['stranded', 'train', 'station', 'place']"
i feel dizzy and lightheaded and i think i might faint,[],"['faint', 'dizzy', 'lightheaded', 'feel', 'think']"
my bike broke down and i am stuck in an isolated area,[],"['isolated', 'bike', 'area', 'broke', 'stuck']"
i need help someone is threatening me and i feel unsafe,[],"['threatening', 'unsafe', 'help', 'need', 'feel']"
i cannot find the nearest hospital and need help urgently,[],"['hospital', 'urgently', 'nearest', 'need', 'help']"
i am lost in the forest and it is getting dark please send help,[],"['forest', 'dark', 'help', 'lost', 'send']"
the taxi driver is taking a different route and i dont feel safe,[],"['taxi', 'route', 'driver', 'safe', 'taking']"
im stuck in a subway station and theres no staff around to help me,[],"['subway', 'station', 'staff', 'stuck', 'help']"
someone is aggressively knocking on my hotel door im scared,[],"['knocking', 'door', 'aggressively', 'hotel', 'scared']"
the ferry left without me and now im stranded on the island,[],"['ferry', 'stranded', 'island', 'left', 'im']"
i can see a huge fire in the distance but i dont know if its safe to stay here,[],"['safe', 'distance', 'stay', 'know', 'huge']"
theres been a landslide and im trapped on this hiking trail,[],"['hiking', 'landslide', 'trail', 'trapped', 'im']"
i feel disoriented after a bad fall i dont know where i am,[],"['disoriented', 'fall', 'feel', 'bad', 'dont']"
ive lost my medication and i need a pharmacy urgently,[],"['pharmacy', 'medication', 'urgently', 'need', 'lost']"
a stranger is blocking my way and wont let me pass i feel unsafe,[],"['stranger', 'blocking', 'unsafe', 'pass', 'way']"
i missed the last train and im stuck at the station overnight,[],"['station', 'train', 'overnight', 'stuck', 'missed']"
ive been stung by a bee and i think im having an allergic reaction,[],"['bee', 'allergic', 'stung', 'reaction', 'im']"
theres heavy snow and my car is stuck i cant drive any further,[],"['snow', 'car', 'drive', 'stuck', 'heavy']"
a stranger tried to grab my arm in the park i need someone to help me,[],"['park', 'stranger', 'grab', 'arm', 'help']"
ive been locked inside a shop and theres no way to get out,[],"['locked', 'shop', 'inside', 'way', 'theres']"
the lift stopped midway,[],"['midway', 'lift', 'stopped']"
